criterio,peso,nota,comentario
Claridad del planteamiento del problema,0.15,6.9,"Excelente planteamiento; tema original (ajedrez sonoro) con objetivos específicos claros y bien redactados."
Justificación y contexto del experimento,0.10,6.8,"Buen estado del arte; reconoce antecedentes de conversión de ajedrez a música y propone un enfoque más estructurado y reproducible."
Metodología y organización del notebook,0.20,6.8,"Metodología clara y paso a paso; bien estructurada la definición de parser, mapeo sonoro y síntesis de audio."
Calidad del código y buenas prácticas,0.15,6.7,"Código ordenado y funcional; puede incorporar comentarios más detallados y ejemplos de prueba automatizados."
Análisis de resultados y visualizaciones,0.15,6.6,"Describe correctamente las transformaciones; se recomienda agregar ejemplos sonoros y visuales de las formas de onda."
Conclusiones y coherencia con objetivos,0.15,6.7,"Conclusiones bien alineadas con los objetivos; sugieren proyecciones futuras (síntesis más compleja, MIDI)."
"Redacción, ortografía y estilo general",0.10,6.4,"Texto claro y formal, pero faltó incluir el escudo de la Universidad como parte del formato institucional solicitado."
Nota final (ponderada),1.00,6.7,"Proyecto altamente original, técnicamente sólido y muy bien fundamentado. Solo se descuenta un pequeño punto formal por no incluir el escudo institucional. ¡Gran trabajo e iniciativa creativa!"
